{
  "address": "0x8c6d1940450A0719b674009093af698Ea44adAE3",
  "abi": [
    {
      "inputs": [
        {
          "internalType": "contract WETH9Interface",
          "name": "_l1Weth",
          "type": "address"
        },
        {
          "internalType": "contract IERC20",
          "name": "_l1Usdc",
          "type": "address"
        },
        {
          "internalType": "contract IMessageService",
          "name": "_l1MessageService",
          "type": "address"
        },
        {
          "internalType": "contract ITokenBridge",
          "name": "_l1TokenBridge",
          "type": "address"
        },
        {
          "internalType": "contract IUSDCBridge",
          "name": "_l1UsdcBridge",
          "type": "address"
        }
      ],
      "stateMutability": "nonpayable",
      "type": "constructor"
    },
    {
      "anonymous": false,
      "inputs": [
        {
          "indexed": false,
          "internalType": "address",
          "name": "target",
          "type": "address"
        },
        {
          "indexed": false,
          "internalType": "bytes",
          "name": "message",
          "type": "bytes"
        }
      ],
      "name": "MessageRelayed",
      "type": "event"
    },
    {
      "anonymous": false,
      "inputs": [
        {
          "indexed": false,
          "internalType": "address",
          "name": "l1Token",
          "type": "address"
        },
        {
          "indexed": false,
          "internalType": "address",
          "name": "l2Token",
          "type": "address"
        },
        {
          "indexed": false,
          "internalType": "uint256",
          "name": "amount",
          "type": "uint256"
        },
        {
          "indexed": false,
          "internalType": "address",
          "name": "to",
          "type": "address"
        }
      ],
      "name": "TokensRelayed",
      "type": "event"
    },
    {
      "inputs": [],
      "name": "l1MessageService",
      "outputs": [
        {
          "internalType": "contract IMessageService",
          "name": "",
          "type": "address"
        }
      ],
      "stateMutability": "view",
      "type": "function"
    },
    {
      "inputs": [],
      "name": "l1TokenBridge",
      "outputs": [
        {
          "internalType": "contract ITokenBridge",
          "name": "",
          "type": "address"
        }
      ],
      "stateMutability": "view",
      "type": "function"
    },
    {
      "inputs": [],
      "name": "l1Usdc",
      "outputs": [
        {
          "internalType": "contract IERC20",
          "name": "",
          "type": "address"
        }
      ],
      "stateMutability": "view",
      "type": "function"
    },
    {
      "inputs": [],
      "name": "l1UsdcBridge",
      "outputs": [
        {
          "internalType": "contract IUSDCBridge",
          "name": "",
          "type": "address"
        }
      ],
      "stateMutability": "view",
      "type": "function"
    },
    {
      "inputs": [],
      "name": "l1Weth",
      "outputs": [
        {
          "internalType": "contract WETH9Interface",
          "name": "",
          "type": "address"
        }
      ],
      "stateMutability": "view",
      "type": "function"
    },
    {
      "inputs": [
        {
          "internalType": "address",
          "name": "target",
          "type": "address"
        },
        {
          "internalType": "bytes",
          "name": "message",
          "type": "bytes"
        }
      ],
      "name": "relayMessage",
      "outputs": [],
      "stateMutability": "payable",
      "type": "function"
    },
    {
      "inputs": [
        {
          "internalType": "address",
          "name": "l1Token",
          "type": "address"
        },
        {
          "internalType": "address",
          "name": "l2Token",
          "type": "address"
        },
        {
          "internalType": "uint256",
          "name": "amount",
          "type": "uint256"
        },
        {
          "internalType": "address",
          "name": "to",
          "type": "address"
        }
      ],
      "name": "relayTokens",
      "outputs": [],
      "stateMutability": "payable",
      "type": "function"
    }
  ],
  "transactionHash": "0x44332cc0a6853c80d57b18b5ba2c0a02b0ef4870df23921303e35b23340d0c80",
  "receipt": {
    "to": null,
    "from": "0x52A79C01f10e6Ea89dED5c3f42F3a0EC362ed090",
    "contractAddress": "0x8c6d1940450A0719b674009093af698Ea44adAE3",
    "transactionIndex": 77,
    "gasUsed": "783548",
    "logsBloom": "0x00000000000000000000000000000000000000000000000000000000000000000000000000000000000000000000000000000000000000000000000000000000000000000000000000000000000000000000000000000000000000000000000000000000000000000000000000000000000000000000000000000000000000000000000000000000000000000000000000000000000000000000000000000000000000000000000000000000000000000000000000000000000000000000000000000000000000000000000000000000000000000000000000000000000000000000000000000000000000000000000000000000000000000000000000000000",
    "blockHash": "0x8117a809a7fe2c4512573a4c9e90f78384214d06116968d3423184be267d735b",
    "transactionHash": "0x44332cc0a6853c80d57b18b5ba2c0a02b0ef4870df23921303e35b23340d0c80",
    "logs": [],
    "blockNumber": 10232818,
    "cumulativeGasUsed": "3133568",
    "status": 1,
    "byzantium": true
  },
  "args": [
    "0xB4FBF271143F4FBf7B91A5ded31805e42b2208d6",
    "0x07865c6e87b9f70255377e024ace6630c1eaa37f",
    "0x70BaD09280FD342D02fe64119779BC1f0791BAC2",
    "0x5506A3805fB8A58Fa58248CC52d2b06D92cA94e6",
    "0x32D123756d32d3eD6580935f8edF416e57b940f4"
  ],
  "numDeployments": 2,
  "solcInputHash": "79c4303e7ff1f82afb40505e20e8a033",
  "metadata": "{\"compiler\":{\"version\":\"0.8.23+commit.f704f362\"},\"language\":\"Solidity\",\"output\":{\"abi\":[{\"inputs\":[{\"internalType\":\"contract WETH9Interface\",\"name\":\"_l1Weth\",\"type\":\"address\"},{\"internalType\":\"contract IERC20\",\"name\":\"_l1Usdc\",\"type\":\"address\"},{\"internalType\":\"contract IMessageService\",\"name\":\"_l1MessageService\",\"type\":\"address\"},{\"internalType\":\"contract ITokenBridge\",\"name\":\"_l1TokenBridge\",\"type\":\"address\"},{\"internalType\":\"contract IUSDCBridge\",\"name\":\"_l1UsdcBridge\",\"type\":\"address\"}],\"stateMutability\":\"nonpayable\",\"type\":\"constructor\"},{\"anonymous\":false,\"inputs\":[{\"indexed\":false,\"internalType\":\"address\",\"name\":\"target\",\"type\":\"address\"},{\"indexed\":false,\"internalType\":\"bytes\",\"name\":\"message\",\"type\":\"bytes\"}],\"name\":\"MessageRelayed\",\"type\":\"event\"},{\"anonymous\":false,\"inputs\":[{\"indexed\":false,\"internalType\":\"address\",\"name\":\"l1Token\",\"type\":\"address\"},{\"indexed\":false,\"internalType\":\"address\",\"name\":\"l2Token\",\"type\":\"address\"},{\"indexed\":false,\"internalType\":\"uint256\",\"name\":\"amount\",\"type\":\"uint256\"},{\"indexed\":false,\"internalType\":\"address\",\"name\":\"to\",\"type\":\"address\"}],\"name\":\"TokensRelayed\",\"type\":\"event\"},{\"inputs\":[],\"name\":\"l1MessageService\",\"outputs\":[{\"internalType\":\"contract IMessageService\",\"name\":\"\",\"type\":\"address\"}],\"stateMutability\":\"view\",\"type\":\"function\"},{\"inputs\":[],\"name\":\"l1TokenBridge\",\"outputs\":[{\"internalType\":\"contract ITokenBridge\",\"name\":\"\",\"type\":\"address\"}],\"stateMutability\":\"view\",\"type\":\"function\"},{\"inputs\":[],\"name\":\"l1Usdc\",\"outputs\":[{\"internalType\":\"contract IERC20\",\"name\":\"\",\"type\":\"address\"}],\"stateMutability\":\"view\",\"type\":\"function\"},{\"inputs\":[],\"name\":\"l1UsdcBridge\",\"outputs\":[{\"internalType\":\"contract IUSDCBridge\",\"name\":\"\",\"type\":\"address\"}],\"stateMutability\":\"view\",\"type\":\"function\"},{\"inputs\":[],\"name\":\"l1Weth\",\"outputs\":[{\"internalType\":\"contract WETH9Interface\",\"name\":\"\",\"type\":\"address\"}],\"stateMutability\":\"view\",\"type\":\"function\"},{\"inputs\":[{\"internalType\":\"address\",\"name\":\"target\",\"type\":\"address\"},{\"internalType\":\"bytes\",\"name\":\"message\",\"type\":\"bytes\"}],\"name\":\"relayMessage\",\"outputs\":[],\"stateMutability\":\"payable\",\"type\":\"function\"},{\"inputs\":[{\"internalType\":\"address\",\"name\":\"l1Token\",\"type\":\"address\"},{\"internalType\":\"address\",\"name\":\"l2Token\",\"type\":\"address\"},{\"internalType\":\"uint256\",\"name\":\"amount\",\"type\":\"uint256\"},{\"internalType\":\"address\",\"name\":\"to\",\"type\":\"address\"}],\"name\":\"relayTokens\",\"outputs\":[],\"stateMutability\":\"payable\",\"type\":\"function\"}],\"devdoc\":{\"kind\":\"dev\",\"methods\":{\"constructor\":{\"params\":{\"_l1MessageService\":\"Canonical message service contract on L1.\",\"_l1TokenBridge\":\"Canonical token bridge contract on L1.\",\"_l1Usdc\":\"USDC address on L1.\",\"_l1UsdcBridge\":\"L1 USDC Bridge to ConsenSys's L2 Linea.\",\"_l1Weth\":\"WETH address on L1.\"}},\"relayMessage(address,bytes)\":{\"params\":{\"message\":\"Data to send to target.\",\"target\":\"Contract on Linea that will receive message.\"}},\"relayTokens(address,address,uint256,address)\":{\"params\":{\"amount\":\"Amount of L1 tokens to deposit and L2 tokens to receive.\",\"l1Token\":\"L1 token to deposit.\",\"l2Token\":\"L2 token to receive.\",\"to\":\"Bridge recipient.\"}}},\"version\":1},\"userdoc\":{\"kind\":\"user\",\"methods\":{\"constructor\":{\"notice\":\"Constructs new Adapter.\"},\"relayMessage(address,bytes)\":{\"notice\":\"Send cross-chain message to target on Linea.\"},\"relayTokens(address,address,uint256,address)\":{\"notice\":\"Bridge tokens to Linea.\"}},\"version\":1}},\"settings\":{\"compilationTarget\":{\"contracts/chain-adapters/Linea_Adapter.sol\":\"Linea_Adapter\"},\"evmVersion\":\"shanghai\",\"libraries\":{},\"metadata\":{\"bytecodeHash\":\"ipfs\",\"useLiteralContent\":true},\"optimizer\":{\"enabled\":true,\"runs\":1000000},\"remappings\":[],\"viaIR\":true},\"sources\":{\"@openzeppelin/contracts/token/ERC20/IERC20.sol\":{\"content\":\"// SPDX-License-Identifier: MIT\\n// OpenZeppelin Contracts (last updated v4.9.0) (token/ERC20/IERC20.sol)\\n\\npragma solidity ^0.8.0;\\n\\n/**\\n * @dev Interface of the ERC20 standard as defined in the EIP.\\n */\\ninterface IERC20 {\\n    /**\\n     * @dev Emitted when `value` tokens are moved from one account (`from`) to\\n     * another (`to`).\\n     *\\n     * Note that `value` may be zero.\\n     */\\n    event Transfer(address indexed from, address indexed to, uint256 value);\\n\\n    /**\\n     * @dev Emitted when the allowance of a `spender` for an `owner` is set by\\n     * a call to {approve}. `value` is the new allowance.\\n     */\\n    event Approval(address indexed owner, address indexed spender, uint256 value);\\n\\n    /**\\n     * @dev Returns the amount of tokens in existence.\\n     */\\n    function totalSupply() external view returns (uint256);\\n\\n    /**\\n     * @dev Returns the amount of tokens owned by `account`.\\n     */\\n    function balanceOf(address account) external view returns (uint256);\\n\\n    /**\\n     * @dev Moves `amount` tokens from the caller's account to `to`.\\n     *\\n     * Returns a boolean value indicating whether the operation succeeded.\\n     *\\n     * Emits a {Transfer} event.\\n     */\\n    function transfer(address to, uint256 amount) external returns (bool);\\n\\n    /**\\n     * @dev Returns the remaining number of tokens that `spender` will be\\n     * allowed to spend on behalf of `owner` through {transferFrom}. This is\\n     * zero by default.\\n     *\\n     * This value changes when {approve} or {transferFrom} are called.\\n     */\\n    function allowance(address owner, address spender) external view returns (uint256);\\n\\n    /**\\n     * @dev Sets `amount` as the allowance of `spender` over the caller's tokens.\\n     *\\n     * Returns a boolean value indicating whether the operation succeeded.\\n     *\\n     * IMPORTANT: Beware that changing an allowance with this method brings the risk\\n     * that someone may use both the old and the new allowance by unfortunate\\n     * transaction ordering. One possible solution to mitigate this race\\n     * condition is to first reduce the spender's allowance to 0 and set the\\n     * desired value afterwards:\\n     * https://github.com/ethereum/EIPs/issues/20#issuecomment-263524729\\n     *\\n     * Emits an {Approval} event.\\n     */\\n    function approve(address spender, uint256 amount) external returns (bool);\\n\\n    /**\\n     * @dev Moves `amount` tokens from `from` to `to` using the\\n     * allowance mechanism. `amount` is then deducted from the caller's\\n     * allowance.\\n     *\\n     * Returns a boolean value indicating whether the operation succeeded.\\n     *\\n     * Emits a {Transfer} event.\\n     */\\n    function transferFrom(address from, address to, uint256 amount) external returns (bool);\\n}\\n\",\"keccak256\":\"0x287b55befed2961a7eabd7d7b1b2839cbca8a5b80ef8dcbb25ed3d4c2002c305\",\"license\":\"MIT\"},\"@openzeppelin/contracts/token/ERC20/extensions/IERC20Permit.sol\":{\"content\":\"// SPDX-License-Identifier: MIT\\n// OpenZeppelin Contracts (last updated v4.9.0) (token/ERC20/extensions/IERC20Permit.sol)\\n\\npragma solidity ^0.8.0;\\n\\n/**\\n * @dev Interface of the ERC20 Permit extension allowing approvals to be made via signatures, as defined in\\n * https://eips.ethereum.org/EIPS/eip-2612[EIP-2612].\\n *\\n * Adds the {permit} method, which can be used to change an account's ERC20 allowance (see {IERC20-allowance}) by\\n * presenting a message signed by the account. By not relying on {IERC20-approve}, the token holder account doesn't\\n * need to send a transaction, and thus is not required to hold Ether at all.\\n */\\ninterface IERC20Permit {\\n    /**\\n     * @dev Sets `value` as the allowance of `spender` over ``owner``'s tokens,\\n     * given ``owner``'s signed approval.\\n     *\\n     * IMPORTANT: The same issues {IERC20-approve} has related to transaction\\n     * ordering also apply here.\\n     *\\n     * Emits an {Approval} event.\\n     *\\n     * Requirements:\\n     *\\n     * - `spender` cannot be the zero address.\\n     * - `deadline` must be a timestamp in the future.\\n     * - `v`, `r` and `s` must be a valid `secp256k1` signature from `owner`\\n     * over the EIP712-formatted function arguments.\\n     * - the signature must use ``owner``'s current nonce (see {nonces}).\\n     *\\n     * For more information on the signature format, see the\\n     * https://eips.ethereum.org/EIPS/eip-2612#specification[relevant EIP\\n     * section].\\n     */\\n    function permit(\\n        address owner,\\n        address spender,\\n        uint256 value,\\n        uint256 deadline,\\n        uint8 v,\\n        bytes32 r,\\n        bytes32 s\\n    ) external;\\n\\n    /**\\n     * @dev Returns the current nonce for `owner`. This value must be\\n     * included whenever a signature is generated for {permit}.\\n     *\\n     * Every successful call to {permit} increases ``owner``'s nonce by one. This\\n     * prevents a signature from being used multiple times.\\n     */\\n    function nonces(address owner) external view returns (uint256);\\n\\n    /**\\n     * @dev Returns the domain separator used in the encoding of the signature for {permit}, as defined by {EIP712}.\\n     */\\n    // solhint-disable-next-line func-name-mixedcase\\n    function DOMAIN_SEPARATOR() external view returns (bytes32);\\n}\\n\",\"keccak256\":\"0xec63854014a5b4f2b3290ab9103a21bdf902a508d0f41a8573fea49e98bf571a\",\"license\":\"MIT\"},\"@openzeppelin/contracts/token/ERC20/utils/SafeERC20.sol\":{\"content\":\"// SPDX-License-Identifier: MIT\\n// OpenZeppelin Contracts (last updated v4.9.3) (token/ERC20/utils/SafeERC20.sol)\\n\\npragma solidity ^0.8.0;\\n\\nimport \\\"../IERC20.sol\\\";\\nimport \\\"../extensions/IERC20Permit.sol\\\";\\nimport \\\"../../../utils/Address.sol\\\";\\n\\n/**\\n * @title SafeERC20\\n * @dev Wrappers around ERC20 operations that throw on failure (when the token\\n * contract returns false). Tokens that return no value (and instead revert or\\n * throw on failure) are also supported, non-reverting calls are assumed to be\\n * successful.\\n * To use this library you can add a `using SafeERC20 for IERC20;` statement to your contract,\\n * which allows you to call the safe operations as `token.safeTransfer(...)`, etc.\\n */\\nlibrary SafeERC20 {\\n    using Address for address;\\n\\n    /**\\n     * @dev Transfer `value` amount of `token` from the calling contract to `to`. If `token` returns no value,\\n     * non-reverting calls are assumed to be successful.\\n     */\\n    function safeTransfer(IERC20 token, address to, uint256 value) internal {\\n        _callOptionalReturn(token, abi.encodeWithSelector(token.transfer.selector, to, value));\\n    }\\n\\n    /**\\n     * @dev Transfer `value` amount of `token` from `from` to `to`, spending the approval given by `from` to the\\n     * calling contract. If `token` returns no value, non-reverting calls are assumed to be successful.\\n     */\\n    function safeTransferFrom(IERC20 token, address from, address to, uint256 value) internal {\\n        _callOptionalReturn(token, abi.encodeWithSelector(token.transferFrom.selector, from, to, value));\\n    }\\n\\n    /**\\n     * @dev Deprecated. This function has issues similar to the ones found in\\n     * {IERC20-approve}, and its usage is discouraged.\\n     *\\n     * Whenever possible, use {safeIncreaseAllowance} and\\n     * {safeDecreaseAllowance} instead.\\n     */\\n    function safeApprove(IERC20 token, address spender, uint256 value) internal {\\n        // safeApprove should only be called when setting an initial allowance,\\n        // or when resetting it to zero. To increase and decrease it, use\\n        // 'safeIncreaseAllowance' and 'safeDecreaseAllowance'\\n        require(\\n            (value == 0) || (token.allowance(address(this), spender) == 0),\\n            \\\"SafeERC20: approve from non-zero to non-zero allowance\\\"\\n        );\\n        _callOptionalReturn(token, abi.encodeWithSelector(token.approve.selector, spender, value));\\n    }\\n\\n    /**\\n     * @dev Increase the calling contract's allowance toward `spender` by `value`. If `token` returns no value,\\n     * non-reverting calls are assumed to be successful.\\n     */\\n    function safeIncreaseAllowance(IERC20 token, address spender, uint256 value) internal {\\n        uint256 oldAllowance = token.allowance(address(this), spender);\\n        _callOptionalReturn(token, abi.encodeWithSelector(token.approve.selector, spender, oldAllowance + value));\\n    }\\n\\n    /**\\n     * @dev Decrease the calling contract's allowance toward `spender` by `value`. If `token` returns no value,\\n     * non-reverting calls are assumed to be successful.\\n     */\\n    function safeDecreaseAllowance(IERC20 token, address spender, uint256 value) internal {\\n        unchecked {\\n            uint256 oldAllowance = token.allowance(address(this), spender);\\n            require(oldAllowance >= value, \\\"SafeERC20: decreased allowance below zero\\\");\\n            _callOptionalReturn(token, abi.encodeWithSelector(token.approve.selector, spender, oldAllowance - value));\\n        }\\n    }\\n\\n    /**\\n     * @dev Set the calling contract's allowance toward `spender` to `value`. If `token` returns no value,\\n     * non-reverting calls are assumed to be successful. Meant to be used with tokens that require the approval\\n     * to be set to zero before setting it to a non-zero value, such as USDT.\\n     */\\n    function forceApprove(IERC20 token, address spender, uint256 value) internal {\\n        bytes memory approvalCall = abi.encodeWithSelector(token.approve.selector, spender, value);\\n\\n        if (!_callOptionalReturnBool(token, approvalCall)) {\\n            _callOptionalReturn(token, abi.encodeWithSelector(token.approve.selector, spender, 0));\\n            _callOptionalReturn(token, approvalCall);\\n        }\\n    }\\n\\n    /**\\n     * @dev Use a ERC-2612 signature to set the `owner` approval toward `spender` on `token`.\\n     * Revert on invalid signature.\\n     */\\n    function safePermit(\\n        IERC20Permit token,\\n        address owner,\\n        address spender,\\n        uint256 value,\\n        uint256 deadline,\\n        uint8 v,\\n        bytes32 r,\\n        bytes32 s\\n    ) internal {\\n        uint256 nonceBefore = token.nonces(owner);\\n        token.permit(owner, spender, value, deadline, v, r, s);\\n        uint256 nonceAfter = token.nonces(owner);\\n        require(nonceAfter == nonceBefore + 1, \\\"SafeERC20: permit did not succeed\\\");\\n    }\\n\\n    /**\\n     * @dev Imitates a Solidity high-level call (i.e. a regular function call to a contract), relaxing the requirement\\n     * on the return value: the return value is optional (but if data is returned, it must not be false).\\n     * @param token The token targeted by the call.\\n     * @param data The call data (encoded using abi.encode or one of its variants).\\n     */\\n    function _callOptionalReturn(IERC20 token, bytes memory data) private {\\n        // We need to perform a low level call here, to bypass Solidity's return data size checking mechanism, since\\n        // we're implementing it ourselves. We use {Address-functionCall} to perform this call, which verifies that\\n        // the target address contains contract code and also asserts for success in the low-level call.\\n\\n        bytes memory returndata = address(token).functionCall(data, \\\"SafeERC20: low-level call failed\\\");\\n        require(returndata.length == 0 || abi.decode(returndata, (bool)), \\\"SafeERC20: ERC20 operation did not succeed\\\");\\n    }\\n\\n    /**\\n     * @dev Imitates a Solidity high-level call (i.e. a regular function call to a contract), relaxing the requirement\\n     * on the return value: the return value is optional (but if data is returned, it must not be false).\\n     * @param token The token targeted by the call.\\n     * @param data The call data (encoded using abi.encode or one of its variants).\\n     *\\n     * This is a variant of {_callOptionalReturn} that silents catches all reverts and returns a bool instead.\\n     */\\n    function _callOptionalReturnBool(IERC20 token, bytes memory data) private returns (bool) {\\n        // We need to perform a low level call here, to bypass Solidity's return data size checking mechanism, since\\n        // we're implementing it ourselves. We cannot use {Address-functionCall} here since this should return false\\n        // and not revert is the subcall reverts.\\n\\n        (bool success, bytes memory returndata) = address(token).call(data);\\n        return\\n            success && (returndata.length == 0 || abi.decode(returndata, (bool))) && Address.isContract(address(token));\\n    }\\n}\\n\",\"keccak256\":\"0xabefac93435967b4d36a4fabcbdbb918d1f0b7ae3c3d85bc30923b326c927ed1\",\"license\":\"MIT\"},\"@openzeppelin/contracts/utils/Address.sol\":{\"content\":\"// SPDX-License-Identifier: MIT\\n// OpenZeppelin Contracts (last updated v4.9.0) (utils/Address.sol)\\n\\npragma solidity ^0.8.1;\\n\\n/**\\n * @dev Collection of functions related to the address type\\n */\\nlibrary Address {\\n    /**\\n     * @dev Returns true if `account` is a contract.\\n     *\\n     * [IMPORTANT]\\n     * ====\\n     * It is unsafe to assume that an address for which this function returns\\n     * false is an externally-owned account (EOA) and not a contract.\\n     *\\n     * Among others, `isContract` will return false for the following\\n     * types of addresses:\\n     *\\n     *  - an externally-owned account\\n     *  - a contract in construction\\n     *  - an address where a contract will be created\\n     *  - an address where a contract lived, but was destroyed\\n     *\\n     * Furthermore, `isContract` will also return true if the target contract within\\n     * the same transaction is already scheduled for destruction by `SELFDESTRUCT`,\\n     * which only has an effect at the end of a transaction.\\n     * ====\\n     *\\n     * [IMPORTANT]\\n     * ====\\n     * You shouldn't rely on `isContract` to protect against flash loan attacks!\\n     *\\n     * Preventing calls from contracts is highly discouraged. It breaks composability, breaks support for smart wallets\\n     * like Gnosis Safe, and does not provide security since it can be circumvented by calling from a contract\\n     * constructor.\\n     * ====\\n     */\\n    function isContract(address account) internal view returns (bool) {\\n        // This method relies on extcodesize/address.code.length, which returns 0\\n        // for contracts in construction, since the code is only stored at the end\\n        // of the constructor execution.\\n\\n        return account.code.length > 0;\\n    }\\n\\n    /**\\n     * @dev Replacement for Solidity's `transfer`: sends `amount` wei to\\n     * `recipient`, forwarding all available gas and reverting on errors.\\n     *\\n     * https://eips.ethereum.org/EIPS/eip-1884[EIP1884] increases the gas cost\\n     * of certain opcodes, possibly making contracts go over the 2300 gas limit\\n     * imposed by `transfer`, making them unable to receive funds via\\n     * `transfer`. {sendValue} removes this limitation.\\n     *\\n     * https://consensys.net/diligence/blog/2019/09/stop-using-soliditys-transfer-now/[Learn more].\\n     *\\n     * IMPORTANT: because control is transferred to `recipient`, care must be\\n     * taken to not create reentrancy vulnerabilities. Consider using\\n     * {ReentrancyGuard} or the\\n     * https://solidity.readthedocs.io/en/v0.8.0/security-considerations.html#use-the-checks-effects-interactions-pattern[checks-effects-interactions pattern].\\n     */\\n    function sendValue(address payable recipient, uint256 amount) internal {\\n        require(address(this).balance >= amount, \\\"Address: insufficient balance\\\");\\n\\n        (bool success, ) = recipient.call{value: amount}(\\\"\\\");\\n        require(success, \\\"Address: unable to send value, recipient may have reverted\\\");\\n    }\\n\\n    /**\\n     * @dev Performs a Solidity function call using a low level `call`. A\\n     * plain `call` is an unsafe replacement for a function call: use this\\n     * function instead.\\n     *\\n     * If `target` reverts with a revert reason, it is bubbled up by this\\n     * function (like regular Solidity function calls).\\n     *\\n     * Returns the raw returned data. To convert to the expected return value,\\n     * use https://solidity.readthedocs.io/en/latest/units-and-global-variables.html?highlight=abi.decode#abi-encoding-and-decoding-functions[`abi.decode`].\\n     *\\n     * Requirements:\\n     *\\n     * - `target` must be a contract.\\n     * - calling `target` with `data` must not revert.\\n     *\\n     * _Available since v3.1._\\n     */\\n    function functionCall(address target, bytes memory data) internal returns (bytes memory) {\\n        return functionCallWithValue(target, data, 0, \\\"Address: low-level call failed\\\");\\n    }\\n\\n    /**\\n     * @dev Same as {xref-Address-functionCall-address-bytes-}[`functionCall`], but with\\n     * `errorMessage` as a fallback revert reason when `target` reverts.\\n     *\\n     * _Available since v3.1._\\n     */\\n    function functionCall(\\n        address target,\\n        bytes memory data,\\n        string memory errorMessage\\n    ) internal returns (bytes memory) {\\n        return functionCallWithValue(target, data, 0, errorMessage);\\n    }\\n\\n    /**\\n     * @dev Same as {xref-Address-functionCall-address-bytes-}[`functionCall`],\\n     * but also transferring `value` wei to `target`.\\n     *\\n     * Requirements:\\n     *\\n     * - the calling contract must have an ETH balance of at least `value`.\\n     * - the called Solidity function must be `payable`.\\n     *\\n     * _Available since v3.1._\\n     */\\n    function functionCallWithValue(address target, bytes memory data, uint256 value) internal returns (bytes memory) {\\n        return functionCallWithValue(target, data, value, \\\"Address: low-level call with value failed\\\");\\n    }\\n\\n    /**\\n     * @dev Same as {xref-Address-functionCallWithValue-address-bytes-uint256-}[`functionCallWithValue`], but\\n     * with `errorMessage` as a fallback revert reason when `target` reverts.\\n     *\\n     * _Available since v3.1._\\n     */\\n    function functionCallWithValue(\\n        address target,\\n        bytes memory data,\\n        uint256 value,\\n        string memory errorMessage\\n    ) internal returns (bytes memory) {\\n        require(address(this).balance >= value, \\\"Address: insufficient balance for call\\\");\\n        (bool success, bytes memory returndata) = target.call{value: value}(data);\\n        return verifyCallResultFromTarget(target, success, returndata, errorMessage);\\n    }\\n\\n    /**\\n     * @dev Same as {xref-Address-functionCall-address-bytes-}[`functionCall`],\\n     * but performing a static call.\\n     *\\n     * _Available since v3.3._\\n     */\\n    function functionStaticCall(address target, bytes memory data) internal view returns (bytes memory) {\\n        return functionStaticCall(target, data, \\\"Address: low-level static call failed\\\");\\n    }\\n\\n    /**\\n     * @dev Same as {xref-Address-functionCall-address-bytes-string-}[`functionCall`],\\n     * but performing a static call.\\n     *\\n     * _Available since v3.3._\\n     */\\n    function functionStaticCall(\\n        address target,\\n        bytes memory data,\\n        string memory errorMessage\\n    ) internal view returns (bytes memory) {\\n        (bool success, bytes memory returndata) = target.staticcall(data);\\n        return verifyCallResultFromTarget(target, success, returndata, errorMessage);\\n    }\\n\\n    /**\\n     * @dev Same as {xref-Address-functionCall-address-bytes-}[`functionCall`],\\n     * but performing a delegate call.\\n     *\\n     * _Available since v3.4._\\n     */\\n    function functionDelegateCall(address target, bytes memory data) internal returns (bytes memory) {\\n        return functionDelegateCall(target, data, \\\"Address: low-level delegate call failed\\\");\\n    }\\n\\n    /**\\n     * @dev Same as {xref-Address-functionCall-address-bytes-string-}[`functionCall`],\\n     * but performing a delegate call.\\n     *\\n     * _Available since v3.4._\\n     */\\n    function functionDelegateCall(\\n        address target,\\n        bytes memory data,\\n        string memory errorMessage\\n    ) internal returns (bytes memory) {\\n        (bool success, bytes memory returndata) = target.delegatecall(data);\\n        return verifyCallResultFromTarget(target, success, returndata, errorMessage);\\n    }\\n\\n    /**\\n     * @dev Tool to verify that a low level call to smart-contract was successful, and revert (either by bubbling\\n     * the revert reason or using the provided one) in case of unsuccessful call or if target was not a contract.\\n     *\\n     * _Available since v4.8._\\n     */\\n    function verifyCallResultFromTarget(\\n        address target,\\n        bool success,\\n        bytes memory returndata,\\n        string memory errorMessage\\n    ) internal view returns (bytes memory) {\\n        if (success) {\\n            if (returndata.length == 0) {\\n                // only check isContract if the call was successful and the return data is empty\\n                // otherwise we already know that it was a contract\\n                require(isContract(target), \\\"Address: call to non-contract\\\");\\n            }\\n            return returndata;\\n        } else {\\n            _revert(returndata, errorMessage);\\n        }\\n    }\\n\\n    /**\\n     * @dev Tool to verify that a low level call was successful, and revert if it wasn't, either by bubbling the\\n     * revert reason or using the provided one.\\n     *\\n     * _Available since v4.3._\\n     */\\n    function verifyCallResult(\\n        bool success,\\n        bytes memory returndata,\\n        string memory errorMessage\\n    ) internal pure returns (bytes memory) {\\n        if (success) {\\n            return returndata;\\n        } else {\\n            _revert(returndata, errorMessage);\\n        }\\n    }\\n\\n    function _revert(bytes memory returndata, string memory errorMessage) private pure {\\n        // Look for revert reason and bubble it up if present\\n        if (returndata.length > 0) {\\n            // The easiest way to bubble the revert reason is using memory via assembly\\n            /// @solidity memory-safe-assembly\\n            assembly {\\n                let returndata_size := mload(returndata)\\n                revert(add(32, returndata), returndata_size)\\n            }\\n        } else {\\n            revert(errorMessage);\\n        }\\n    }\\n}\\n\",\"keccak256\":\"0x006dd67219697fe68d7fbfdea512e7c4cb64a43565ed86171d67e844982da6fa\",\"license\":\"MIT\"},\"contracts/chain-adapters/Linea_Adapter.sol\":{\"content\":\"// SPDX-License-Identifier: BUSL-1.1\\npragma solidity ^0.8.0;\\n\\nimport \\\"./interfaces/AdapterInterface.sol\\\";\\nimport \\\"../external/interfaces/WETH9Interface.sol\\\";\\n\\nimport \\\"@openzeppelin/contracts/token/ERC20/IERC20.sol\\\";\\nimport \\\"@openzeppelin/contracts/token/ERC20/utils/SafeERC20.sol\\\";\\n\\ninterface IMessageService {\\n    /**\\n     * @dev Emitted when a message is sent.\\n     * @dev We include the message hash to save hashing costs on the rollup.\\n     */\\n    event MessageSent(\\n        address indexed _from,\\n        address indexed _to,\\n        uint256 _fee,\\n        uint256 _value,\\n        uint256 _nonce,\\n        bytes _calldata,\\n        bytes32 indexed _messageHash\\n    );\\n\\n    /**\\n     * @dev Emitted when a message is claimed.\\n     */\\n    event MessageClaimed(bytes32 indexed _messageHash);\\n\\n    /**\\n     * @dev Thrown when fees are lower than the minimum fee.\\n     */\\n    error FeeTooLow();\\n\\n    /**\\n     * @dev Thrown when fees are lower than value.\\n     */\\n    error ValueShouldBeGreaterThanFee();\\n\\n    /**\\n     * @dev Thrown when the value sent is less than the fee.\\n     * @dev Value to forward on is msg.value - _fee.\\n     */\\n    error ValueSentTooLow();\\n\\n    /**\\n     * @dev Thrown when the destination address reverts.\\n     */\\n    error MessageSendingFailed(address destination);\\n\\n    /**\\n     * @dev Thrown when the destination address reverts.\\n     */\\n    error FeePaymentFailed(address recipient);\\n\\n    /**\\n     * @notice Sends a message for transporting from the given chain.\\n     * @dev This function should be called with a msg.value = _value + _fee. The fee will be paid on the destination chain.\\n     * @param _to The destination address on the destination chain.\\n     * @param _fee The message service fee on the origin chain.\\n     * @param _calldata The calldata used by the destination message service to call the destination contract.\\n     */\\n    function sendMessage(\\n        address _to,\\n        uint256 _fee,\\n        bytes calldata _calldata\\n    ) external payable;\\n\\n    /**\\n     * @notice Deliver a message to the destination chain.\\n     * @notice Is called automatically by the Postman, dApp or end user.\\n     * @param _from The msg.sender calling the origin message service.\\n     * @param _to The destination address on the destination chain.\\n     * @param _value The value to be transferred to the destination address.\\n     * @param _fee The message service fee on the origin chain.\\n     * @param _feeRecipient Address that will receive the fees.\\n     * @param _calldata The calldata used by the destination message service to call/forward to the destination contract.\\n     * @param _nonce Unique message number.\\n     */\\n    function claimMessage(\\n        address _from,\\n        address _to,\\n        uint256 _fee,\\n        uint256 _value,\\n        address payable _feeRecipient,\\n        bytes calldata _calldata,\\n        uint256 _nonce\\n    ) external;\\n\\n    /**\\n     * @notice Returns the original sender of the message on the origin layer.\\n     * @return The original sender of the message on the origin layer.\\n     */\\n    function sender() external view returns (address);\\n}\\n\\ninterface ITokenBridge {\\n    event TokenReserved(address indexed token);\\n    event CustomContractSet(address indexed nativeToken, address indexed customContract, address indexed setBy);\\n    event BridgingInitiated(address indexed sender, address recipient, address indexed token, uint256 indexed amount);\\n    event BridgingFinalized(\\n        address indexed nativeToken,\\n        address indexed bridgedToken,\\n        uint256 indexed amount,\\n        address recipient\\n    );\\n    event NewToken(address indexed token);\\n    event NewTokenDeployed(address indexed bridgedToken, address indexed nativeToken);\\n    event RemoteTokenBridgeSet(address indexed remoteTokenBridge, address indexed setBy);\\n    event TokenDeployed(address indexed token);\\n    event DeploymentConfirmed(address[] tokens, address indexed confirmedBy);\\n    event MessageServiceUpdated(\\n        address indexed newMessageService,\\n        address indexed oldMessageService,\\n        address indexed setBy\\n    );\\n\\n    error ReservedToken(address token);\\n    error RemoteTokenBridgeAlreadySet(address remoteTokenBridge);\\n    error AlreadyBridgedToken(address token);\\n    error InvalidPermitData(bytes4 permitData, bytes4 permitSelector);\\n    error PermitNotFromSender(address owner);\\n    error PermitNotAllowingBridge(address spender);\\n    error ZeroAmountNotAllowed(uint256 amount);\\n    error NotReserved(address token);\\n    error TokenNotDeployed(address token);\\n    error TokenNativeOnOtherLayer(address token);\\n    error AlreadyBrigedToNativeTokenSet(address token);\\n    error StatusAddressNotAllowed(address token);\\n\\n    /**\\n     * @notice This function is the single entry point to bridge tokens to the\\n     *   other chain, both for native and already bridged tokens. You can use it\\n     *   to bridge any ERC20. If the token is bridged for the first time an ERC20\\n     *   (BridgedToken.sol) will be automatically deployed on the target chain.\\n     * @dev User should first allow the bridge to transfer tokens on his behalf.\\n     *   Alternatively, you can use `bridgeTokenWithPermit` to do so in a single\\n     *   transaction. If you want the transfer to be automatically executed on the\\n     *   destination chain. You should send enough ETH to pay the postman fees.\\n     *   Note that Linea can reserve some tokens (which use a dedicated bridge).\\n     *   In this case, the token cannot be bridged. Linea can only reserve tokens\\n     *   that have not been bridged yet.\\n     *   Linea can pause the bridge for security reason. In this case new bridge\\n     *   transaction would revert.\\n     * @param _token The address of the token to be bridged.\\n     * @param _amount The amount of the token to be bridged.\\n     * @param _recipient The address that will receive the tokens on the other chain.\\n     */\\n    function bridgeToken(\\n        address _token,\\n        uint256 _amount,\\n        address _recipient\\n    ) external payable;\\n\\n    /**\\n     * @notice Similar to `bridgeToken` function but allows to pass additional\\n     *   permit data to do the ERC20 approval in a single transaction.\\n     * @param _token The address of the token to be bridged.\\n     * @param _amount The amount of the token to be bridged.\\n     * @param _recipient The address that will receive the tokens on the other chain.\\n     * @param _permitData The permit data for the token, if applicable.\\n     */\\n    function bridgeTokenWithPermit(\\n        address _token,\\n        uint256 _amount,\\n        address _recipient,\\n        bytes calldata _permitData\\n    ) external payable;\\n\\n    /**\\n     * @dev It can only be called from the Message Service. To finalize the bridging\\n     *   process, a user or postmen needs to use the `claimMessage` function of the\\n     *   Message Service to trigger the transaction.\\n     * @param _nativeToken The address of the token on its native chain.\\n     * @param _amount The amount of the token to be received.\\n     * @param _recipient The address that will receive the tokens.\\n     * @param _chainId The source chainId or target chaindId for this token\\n     * @param _tokenMetadata Additional data used to deploy the bridged token if it\\n     *   doesn't exist already.\\n     */\\n    function completeBridging(\\n        address _nativeToken,\\n        uint256 _amount,\\n        address _recipient,\\n        uint256 _chainId,\\n        bytes calldata _tokenMetadata\\n    ) external;\\n\\n    /**\\n     * @dev Change the address of the Message Service.\\n     * @param _messageService The address of the new Message Service.\\n     */\\n    function setMessageService(address _messageService) external;\\n\\n    /**\\n     * @dev It can only be called from the Message Service. To change the status of\\n     *   the native tokens to DEPLOYED meaning they have been deployed on the other chain\\n     *   a user or postman needs to use the `claimMessage` function of the\\n     *   Message Service to trigger the transaction.\\n     * @param _nativeTokens The addresses of the native tokens.\\n     */\\n    function setDeployed(address[] memory _nativeTokens) external;\\n\\n    /**\\n     * @dev Sets the address of the remote token bridge. Can only be called once.\\n     * @param _remoteTokenBridge The address of the remote token bridge to be set.\\n     */\\n    function setRemoteTokenBridge(address _remoteTokenBridge) external;\\n\\n    /**\\n     * @dev Removes a token from the reserved list.\\n     * @param _token The address of the token to be removed from the reserved list.\\n     */\\n    function removeReserved(address _token) external;\\n\\n    /**\\n     * @dev Linea can set a custom ERC20 contract for specific ERC20.\\n     *   For security purpose, Linea can only call this function if the token has\\n     *   not been bridged yet.\\n     * @param _nativeToken address of the token on the source chain.\\n     * @param _targetContract address of the custom contract.\\n     */\\n    function setCustomContract(address _nativeToken, address _targetContract) external;\\n\\n    /**\\n     * @dev Pause the contract, can only be called by the owner.\\n     */\\n    function pause() external;\\n\\n    /**\\n     * @dev Unpause the contract, can only be called by the owner.\\n     */\\n    function unpause() external;\\n}\\n\\ninterface IUSDCBridge {\\n    event MessageServiceUpdated(address indexed oldAddress, address indexed newAddress);\\n    event RemoteUSDCBridgeSet(address indexed newRemoteUSDCBridge);\\n    event Deposited(address indexed depositor, uint256 amount, address indexed to);\\n    event ReceivedFromOtherLayer(address indexed recipient, uint256 indexed amount);\\n\\n    error NoBurnCapabilities(address addr);\\n    error AmountTooBig(uint256 amount, uint256 limit);\\n    error NotMessageService(address addr, address messageService);\\n    error ZeroAmountNotAllowed(uint256 amount);\\n    error NotFromRemoteUSDCBridge(address sender, address remoteUSDCBridge);\\n    error ZeroAddressNotAllowed(address addr);\\n    error RemoteUSDCBridgeNotSet();\\n    error SenderBalanceTooLow(uint256 amount, uint256 balance);\\n    error SameMessageServiceAddr(address messageService);\\n    error RemoteUSDCBridgeAlreadySet(address remoteUSDCBridge);\\n\\n    /**\\n     * @dev Sends the sender's USDC from L1 to L2, locks the USDC sent\\n     * in this contract and sends a message to the message bridge\\n     * contract to mint the equivalent USDC on L2\\n     * @param amount The amount of USDC to send\\n     */\\n    function deposit(uint256 amount) external;\\n\\n    /**\\n     * @dev Sends the sender's USDC from L1 to the recipient on L2, locks the USDC sent\\n     * in this contract and sends a message to the message bridge\\n     * contract to mint the equivalent USDC on L2\\n     * @param amount The amount of USDC to send\\n     * @param to The recipient's address to receive the funds\\n     */\\n    function depositTo(uint256 amount, address to) external payable;\\n\\n    /**\\n     * @dev This function is called by the message bridge when transferring USDC from L2 to L1\\n     * It burns the USDC on L2 and unlocks the equivalent USDC from this contract to the recipient\\n     * @param recipient The recipient to receive the USDC on L1\\n     * @param amount The amount of USDC to receive\\n     */\\n    function receiveFromOtherLayer(address recipient, uint256 amount) external;\\n}\\n\\n// solhint-disable-next-line contract-name-camelcase\\ncontract Linea_Adapter is AdapterInterface {\\n    using SafeERC20 for IERC20;\\n\\n    WETH9Interface public immutable l1Weth;\\n    IERC20 public immutable l1Usdc;\\n\\n    IMessageService public immutable l1MessageService;\\n    ITokenBridge public immutable l1TokenBridge;\\n    IUSDCBridge public immutable l1UsdcBridge;\\n\\n    /**\\n     * @notice Constructs new Adapter.\\n     * @param _l1Weth WETH address on L1.\\n     * @param _l1Usdc USDC address on L1.\\n     * @param _l1MessageService Canonical message service contract on L1.\\n     * @param _l1TokenBridge Canonical token bridge contract on L1.\\n     * @param _l1UsdcBridge L1 USDC Bridge to ConsenSys's L2 Linea.\\n     */\\n    constructor(\\n        WETH9Interface _l1Weth,\\n        IERC20 _l1Usdc,\\n        IMessageService _l1MessageService,\\n        ITokenBridge _l1TokenBridge,\\n        IUSDCBridge _l1UsdcBridge\\n    ) {\\n        l1Weth = _l1Weth;\\n        l1Usdc = _l1Usdc;\\n        l1MessageService = _l1MessageService;\\n        l1TokenBridge = _l1TokenBridge;\\n        l1UsdcBridge = _l1UsdcBridge;\\n    }\\n\\n    /**\\n     * @notice Send cross-chain message to target on Linea.\\n     * @param target Contract on Linea that will receive message.\\n     * @param message Data to send to target.\\n     */\\n    function relayMessage(address target, bytes calldata message) external payable override {\\n        l1MessageService.sendMessage{ value: msg.value }(target, 0, message);\\n        emit MessageRelayed(target, message);\\n    }\\n\\n    /**\\n     * @notice Bridge tokens to Linea.\\n     * @param l1Token L1 token to deposit.\\n     * @param l2Token L2 token to receive.\\n     * @param amount Amount of L1 tokens to deposit and L2 tokens to receive.\\n     * @param to Bridge recipient.\\n     */\\n    function relayTokens(\\n        address l1Token,\\n        address l2Token,\\n        uint256 amount,\\n        address to\\n    ) external payable override {\\n        // If the l1Token is WETH then unwrap it to ETH then send the ETH directly\\n        // via the Canoncial Message Service.\\n        if (l1Token == address(l1Weth)) {\\n            l1Weth.withdraw(amount);\\n            l1MessageService.sendMessage{ value: amount }(to, 0, \\\"\\\");\\n        }\\n        // If the l1Token is USDC, then we need sent it via the USDC Bridge.\\n        else if (l1Token == address(l1Usdc)) {\\n            IERC20(l1Token).safeIncreaseAllowance(address(l1UsdcBridge), amount);\\n            l1UsdcBridge.depositTo(amount, to);\\n        }\\n        // For other tokens, we can use the Canonical Token Bridge.\\n        else {\\n            IERC20(l1Token).safeIncreaseAllowance(address(l1TokenBridge), amount);\\n            l1TokenBridge.bridgeToken(l1Token, amount, to);\\n        }\\n\\n        emit TokensRelayed(l1Token, l2Token, amount, to);\\n    }\\n}\\n\",\"keccak256\":\"0x78f994d9e64c3b724c867dcd4e05febd2787b91b3d8f894fc4e8395884ab7cf4\",\"license\":\"BUSL-1.1\"},\"contracts/chain-adapters/interfaces/AdapterInterface.sol\":{\"content\":\"// SPDX-License-Identifier: BUSL-1.1\\npragma solidity ^0.8.0;\\n\\n/**\\n * @notice Sends cross chain messages and tokens to contracts on a specific L2 network.\\n * This interface is implemented by an adapter contract that is deployed on L1.\\n */\\n\\ninterface AdapterInterface {\\n    event MessageRelayed(address target, bytes message);\\n\\n    event TokensRelayed(address l1Token, address l2Token, uint256 amount, address to);\\n\\n    /**\\n     * @notice Send message to `target` on L2.\\n     * @dev This method is marked payable because relaying the message might require a fee\\n     * to be paid by the sender to forward the message to L2. However, it will not send msg.value\\n     * to the target contract on L2.\\n     * @param target L2 address to send message to.\\n     * @param message Message to send to `target`.\\n     */\\n    function relayMessage(address target, bytes calldata message) external payable;\\n\\n    /**\\n     * @notice Send `amount` of `l1Token` to `to` on L2. `l2Token` is the L2 address equivalent of `l1Token`.\\n     * @dev This method is marked payable because relaying the message might require a fee\\n     * to be paid by the sender to forward the message to L2. However, it will not send msg.value\\n     * to the target contract on L2.\\n     * @param l1Token L1 token to bridge.\\n     * @param l2Token L2 token to receive.\\n     * @param amount Amount of `l1Token` to bridge.\\n     * @param to Bridge recipient.\\n     */\\n    function relayTokens(\\n        address l1Token,\\n        address l2Token,\\n        uint256 amount,\\n        address to\\n    ) external payable;\\n}\\n\",\"keccak256\":\"0x1d52fcb8b10dc7f260345918c1a90d496a4c9f774402cbd5ebde881b8fed6d50\",\"license\":\"BUSL-1.1\"},\"contracts/external/interfaces/WETH9Interface.sol\":{\"content\":\"// SPDX-License-Identifier: BUSL-1.1\\npragma solidity ^0.8.0;\\n\\n/**\\n * @notice Interface for the WETH9 contract.\\n */\\ninterface WETH9Interface {\\n    /**\\n     * @notice Burn Wrapped Ether and receive native Ether.\\n     * @param wad Amount of WETH to unwrap and send to caller.\\n     */\\n    function withdraw(uint256 wad) external;\\n\\n    /**\\n     * @notice Lock native Ether and mint Wrapped Ether ERC20\\n     * @dev msg.value is amount of Wrapped Ether to mint/Ether to lock.\\n     */\\n    function deposit() external payable;\\n\\n    /**\\n     * @notice Get balance of WETH held by `guy`.\\n     * @param guy Address to get balance of.\\n     * @return wad Amount of WETH held by `guy`.\\n     */\\n    function balanceOf(address guy) external view returns (uint256 wad);\\n\\n    /**\\n     * @notice Transfer `wad` of WETH from caller to `guy`.\\n     * @param guy Address to send WETH to.\\n     * @param wad Amount of WETH to send.\\n     * @return ok True if transfer succeeded.\\n     */\\n    function transfer(address guy, uint256 wad) external returns (bool);\\n}\\n\",\"keccak256\":\"0x3f7892554ec7f54681fdd3cc18a41346c246c9c1afba016c52990ef77741f718\",\"license\":\"BUSL-1.1\"}},\"version\":1}",
  "bytecode": "0x6101203461010257601f610e5938819003918201601f19168301916001600160401b038311848410176101065780849260a0946040528339810103126101025780516001600160a01b03919082811681036101025760208201518381168103610102576040830151918483168303610102576060840151938585168503610102576080015194851685036101025760805260a05260c05260e052610100908152604051610d3e918261011b833960805182818161033d01526107d0015260a0518281816102a701526104ba015260c05182818160f60152818161023801526103b3015260e0518281816105b101526107640152518181816104e301526106f60152f35b5f80fd5b634e487b7160e01b5f52604160045260245ffdfe6080604081815260049081361015610015575f80fd5b5f925f3560e01c908163146bf4b1146107885750806336c717c11461071a578063385a6970146106ac57806352c8c75c146102cb57806356c3b5871461025c57806364aaef7e146101ed5763e6eb8ade1461006e575f80fd5b807ffffffffffffffffffffffffffffffffffffffffffffffffffffffffffffffffc3601126101e95761009f6107f4565b91602435928467ffffffffffffffff918286116101e557366023870112156101e557858401359283116101e557602486019560248436920101116101e55773ffffffffffffffffffffffffffffffffffffffff90817f00000000000000000000000000000000000000000000000000000000000000001690813b156101e157839187519384927f9f3ce55a00000000000000000000000000000000000000000000000000000000845216809783015282602483015260606044830152818061016b60648201898d610899565b039134905af180156101d7576101bf575b50507f9e6c52944e331ba6270e7fe4cea2a4086bae8f7a27e1cdba07f416806f5d0ac4936101b99184519485948552806020860152840191610899565b0390a180f35b6101c890610817565b6101d357845f61017c565b8480fd5b85513d84823e3d90fd5b8380fd5b5080fd5b8280fd5b8382346101e557817ffffffffffffffffffffffffffffffffffffffffffffffffffffffffffffffffc3601126101e5576020905173ffffffffffffffffffffffffffffffffffffffff7f0000000000000000000000000000000000000000000000000000000000000000168152f35b8382346101e557817ffffffffffffffffffffffffffffffffffffffffffffffffffffffffffffffffc3601126101e5576020905173ffffffffffffffffffffffffffffffffffffffff7f0000000000000000000000000000000000000000000000000000000000000000168152f35b509060807ffffffffffffffffffffffffffffffffffffffffffffffffffffffffffffffffc3601126106a8576102ff6107f4565b9060243573ffffffffffffffffffffffffffffffffffffffff908181168091036106a85760443591606435938185168095036106a8579481169487917f000000000000000000000000000000000000000000000000000000000000000081168781036104b757803b156101e15783809160248b51809481937f2e1a7d4d0000000000000000000000000000000000000000000000000000000083528b898401525af19081156104ad578491610499575b50507f00000000000000000000000000000000000000000000000000000000000000001690813b156101e9578560848492878b5195869485937f9f3ce55a000000000000000000000000000000000000000000000000000000008552840152856024840152606060448401528560648401525af1801561048f5761046f575b5050907fd7e09655439c3932e55857df3220186e5a7f0980825f20691c2b35d941dee75b9460809493925b815194855260208501528301526060820152a180f35b61047d909594939295610817565b61048b57909192855f61042e565b8580fd5b87513d84823e3d90fd5b6104a290610817565b6101e957825f6103af565b89513d86823e3d90fd5b507f0000000000000000000000000000000000000000000000000000000000000000811687036105a7577f0000000000000000000000000000000000000000000000000000000000000000169061050f8583896108d7565b813b156101e9578460448492838b5195869485937f70aff70f0000000000000000000000000000000000000000000000000000000085528401528a60248401525af1801561048f5761058b575b5050907fd7e09655439c3932e55857df3220186e5a7f0980825f20691c2b35d941dee75b946080949392610459565b610599909594939295610817565b61048b57909192855f61055c565b90915095929394957f000000000000000000000000000000000000000000000000000000000000000016906105dd8583896108d7565b813b156106a8578660645f9283875195869485937f522ea81a0000000000000000000000000000000000000000000000000000000085528401528960248401528a60448401525af1801561069e5761065e575b5091608093917fd7e09655439c3932e55857df3220186e5a7f0980825f20691c2b35d941dee75b9593610459565b7fd7e09655439c3932e55857df3220186e5a7f0980825f20691c2b35d941dee75b95939196509161069160809593610817565b5f96919395509193610630565b83513d5f823e3d90fd5b5f80fd5b50346106a8575f7ffffffffffffffffffffffffffffffffffffffffffffffffffffffffffffffffc3601126106a8576020905173ffffffffffffffffffffffffffffffffffffffff7f0000000000000000000000000000000000000000000000000000000000000000168152f35b50346106a8575f7ffffffffffffffffffffffffffffffffffffffffffffffffffffffffffffffffc3601126106a8576020905173ffffffffffffffffffffffffffffffffffffffff7f0000000000000000000000000000000000000000000000000000000000000000168152f35b346106a8575f7ffffffffffffffffffffffffffffffffffffffffffffffffffffffffffffffffc3601126106a85760209073ffffffffffffffffffffffffffffffffffffffff7f0000000000000000000000000000000000000000000000000000000000000000168152f35b6004359073ffffffffffffffffffffffffffffffffffffffff821682036106a857565b67ffffffffffffffff811161082b57604052565b7f4e487b71000000000000000000000000000000000000000000000000000000005f52604160045260245ffd5b90601f7fffffffffffffffffffffffffffffffffffffffffffffffffffffffffffffffe0910116810190811067ffffffffffffffff82111761082b57604052565b601f82602094937fffffffffffffffffffffffffffffffffffffffffffffffffffffffffffffffe093818652868601375f8582860101520116010190565b9173ffffffffffffffffffffffffffffffffffffffff80931660409081517fdd62ed3e0000000000000000000000000000000000000000000000000000000081526004953087830152602495169182868301526020948583604481855afa928315610bde575f93610baf575b508201809211610b8457835191858301937f095ea7b300000000000000000000000000000000000000000000000000000000855287840152604483015260448252608082019267ffffffffffffffff9280851084861117610b595760c0810185811085821117610b2e5786528685527f5361666545524332303a206c6f772d6c6576656c2063616c6c206661696c656460a0820152515f9182919082855af1903d15610b1f573d928311610af45790610a39939291855192610a2c887fffffffffffffffffffffffffffffffffffffffffffffffffffffffffffffffe0601f8401160185610858565b83523d5f8885013e610be8565b8051838115918215610ad4575b5050905015610a555750505050565b517f08c379a000000000000000000000000000000000000000000000000000000000815292830152602a908201527f5361666545524332303a204552433230206f7065726174696f6e20646964206e60448201527f6f742073756363656564000000000000000000000000000000000000000000006064820152608490fd5b83809293500103126106a85782015180151581036106a85780835f610a46565b866041897f4e487b71000000000000000000000000000000000000000000000000000000005f52525ffd5b90610a39939250606091610be8565b8860418b7f4e487b71000000000000000000000000000000000000000000000000000000005f52525ffd5b8760418a7f4e487b71000000000000000000000000000000000000000000000000000000005f52525ffd5b856011887f4e487b71000000000000000000000000000000000000000000000000000000005f52525ffd5b9092508581813d8311610bd7575b610bc78183610858565b810103126106a85751915f610943565b503d610bbd565b85513d5f823e3d90fd5b91929015610c635750815115610bfc575090565b3b15610c055790565b60646040517f08c379a000000000000000000000000000000000000000000000000000000000815260206004820152601d60248201527f416464726573733a2063616c6c20746f206e6f6e2d636f6e74726163740000006044820152fd5b825190915015610c765750805190602001fd5b604051907f08c379a00000000000000000000000000000000000000000000000000000000082528160208060048301528251928360248401525f5b848110610cf1575050507fffffffffffffffffffffffffffffffffffffffffffffffffffffffffffffffe0601f835f604480968601015201168101030190fd5b818101830151868201604401528593508201610cb156fea2646970667358221220d1af346268b43260a74ee781ff1752f1118ea639cd2aa77d9c11e9b5199c68b064736f6c63430008170033",
  "deployedBytecode": "0x6080604081815260049081361015610015575f80fd5b5f925f3560e01c908163146bf4b1146107885750806336c717c11461071a578063385a6970146106ac57806352c8c75c146102cb57806356c3b5871461025c57806364aaef7e146101ed5763e6eb8ade1461006e575f80fd5b807ffffffffffffffffffffffffffffffffffffffffffffffffffffffffffffffffc3601126101e95761009f6107f4565b91602435928467ffffffffffffffff918286116101e557366023870112156101e557858401359283116101e557602486019560248436920101116101e55773ffffffffffffffffffffffffffffffffffffffff90817f00000000000000000000000000000000000000000000000000000000000000001690813b156101e157839187519384927f9f3ce55a00000000000000000000000000000000000000000000000000000000845216809783015282602483015260606044830152818061016b60648201898d610899565b039134905af180156101d7576101bf575b50507f9e6c52944e331ba6270e7fe4cea2a4086bae8f7a27e1cdba07f416806f5d0ac4936101b99184519485948552806020860152840191610899565b0390a180f35b6101c890610817565b6101d357845f61017c565b8480fd5b85513d84823e3d90fd5b8380fd5b5080fd5b8280fd5b8382346101e557817ffffffffffffffffffffffffffffffffffffffffffffffffffffffffffffffffc3601126101e5576020905173ffffffffffffffffffffffffffffffffffffffff7f0000000000000000000000000000000000000000000000000000000000000000168152f35b8382346101e557817ffffffffffffffffffffffffffffffffffffffffffffffffffffffffffffffffc3601126101e5576020905173ffffffffffffffffffffffffffffffffffffffff7f0000000000000000000000000000000000000000000000000000000000000000168152f35b509060807ffffffffffffffffffffffffffffffffffffffffffffffffffffffffffffffffc3601126106a8576102ff6107f4565b9060243573ffffffffffffffffffffffffffffffffffffffff908181168091036106a85760443591606435938185168095036106a8579481169487917f000000000000000000000000000000000000000000000000000000000000000081168781036104b757803b156101e15783809160248b51809481937f2e1a7d4d0000000000000000000000000000000000000000000000000000000083528b898401525af19081156104ad578491610499575b50507f00000000000000000000000000000000000000000000000000000000000000001690813b156101e9578560848492878b5195869485937f9f3ce55a000000000000000000000000000000000000000000000000000000008552840152856024840152606060448401528560648401525af1801561048f5761046f575b5050907fd7e09655439c3932e55857df3220186e5a7f0980825f20691c2b35d941dee75b9460809493925b815194855260208501528301526060820152a180f35b61047d909594939295610817565b61048b57909192855f61042e565b8580fd5b87513d84823e3d90fd5b6104a290610817565b6101e957825f6103af565b89513d86823e3d90fd5b507f0000000000000000000000000000000000000000000000000000000000000000811687036105a7577f0000000000000000000000000000000000000000000000000000000000000000169061050f8583896108d7565b813b156101e9578460448492838b5195869485937f70aff70f0000000000000000000000000000000000000000000000000000000085528401528a60248401525af1801561048f5761058b575b5050907fd7e09655439c3932e55857df3220186e5a7f0980825f20691c2b35d941dee75b946080949392610459565b610599909594939295610817565b61048b57909192855f61055c565b90915095929394957f000000000000000000000000000000000000000000000000000000000000000016906105dd8583896108d7565b813b156106a8578660645f9283875195869485937f522ea81a0000000000000000000000000000000000000000000000000000000085528401528960248401528a60448401525af1801561069e5761065e575b5091608093917fd7e09655439c3932e55857df3220186e5a7f0980825f20691c2b35d941dee75b9593610459565b7fd7e09655439c3932e55857df3220186e5a7f0980825f20691c2b35d941dee75b95939196509161069160809593610817565b5f96919395509193610630565b83513d5f823e3d90fd5b5f80fd5b50346106a8575f7ffffffffffffffffffffffffffffffffffffffffffffffffffffffffffffffffc3601126106a8576020905173ffffffffffffffffffffffffffffffffffffffff7f0000000000000000000000000000000000000000000000000000000000000000168152f35b50346106a8575f7ffffffffffffffffffffffffffffffffffffffffffffffffffffffffffffffffc3601126106a8576020905173ffffffffffffffffffffffffffffffffffffffff7f0000000000000000000000000000000000000000000000000000000000000000168152f35b346106a8575f7ffffffffffffffffffffffffffffffffffffffffffffffffffffffffffffffffc3601126106a85760209073ffffffffffffffffffffffffffffffffffffffff7f0000000000000000000000000000000000000000000000000000000000000000168152f35b6004359073ffffffffffffffffffffffffffffffffffffffff821682036106a857565b67ffffffffffffffff811161082b57604052565b7f4e487b71000000000000000000000000000000000000000000000000000000005f52604160045260245ffd5b90601f7fffffffffffffffffffffffffffffffffffffffffffffffffffffffffffffffe0910116810190811067ffffffffffffffff82111761082b57604052565b601f82602094937fffffffffffffffffffffffffffffffffffffffffffffffffffffffffffffffe093818652868601375f8582860101520116010190565b9173ffffffffffffffffffffffffffffffffffffffff80931660409081517fdd62ed3e0000000000000000000000000000000000000000000000000000000081526004953087830152602495169182868301526020948583604481855afa928315610bde575f93610baf575b508201809211610b8457835191858301937f095ea7b300000000000000000000000000000000000000000000000000000000855287840152604483015260448252608082019267ffffffffffffffff9280851084861117610b595760c0810185811085821117610b2e5786528685527f5361666545524332303a206c6f772d6c6576656c2063616c6c206661696c656460a0820152515f9182919082855af1903d15610b1f573d928311610af45790610a39939291855192610a2c887fffffffffffffffffffffffffffffffffffffffffffffffffffffffffffffffe0601f8401160185610858565b83523d5f8885013e610be8565b8051838115918215610ad4575b5050905015610a555750505050565b517f08c379a000000000000000000000000000000000000000000000000000000000815292830152602a908201527f5361666545524332303a204552433230206f7065726174696f6e20646964206e60448201527f6f742073756363656564000000000000000000000000000000000000000000006064820152608490fd5b83809293500103126106a85782015180151581036106a85780835f610a46565b866041897f4e487b71000000000000000000000000000000000000000000000000000000005f52525ffd5b90610a39939250606091610be8565b8860418b7f4e487b71000000000000000000000000000000000000000000000000000000005f52525ffd5b8760418a7f4e487b71000000000000000000000000000000000000000000000000000000005f52525ffd5b856011887f4e487b71000000000000000000000000000000000000000000000000000000005f52525ffd5b9092508581813d8311610bd7575b610bc78183610858565b810103126106a85751915f610943565b503d610bbd565b85513d5f823e3d90fd5b91929015610c635750815115610bfc575090565b3b15610c055790565b60646040517f08c379a000000000000000000000000000000000000000000000000000000000815260206004820152601d60248201527f416464726573733a2063616c6c20746f206e6f6e2d636f6e74726163740000006044820152fd5b825190915015610c765750805190602001fd5b604051907f08c379a00000000000000000000000000000000000000000000000000000000082528160208060048301528251928360248401525f5b848110610cf1575050507fffffffffffffffffffffffffffffffffffffffffffffffffffffffffffffffe0601f835f604480968601015201168101030190fd5b818101830151868201604401528593508201610cb156fea2646970667358221220d1af346268b43260a74ee781ff1752f1118ea639cd2aa77d9c11e9b5199c68b064736f6c63430008170033",
  "devdoc": {
    "kind": "dev",
    "methods": {
      "constructor": {
        "params": {
          "_l1MessageService": "Canonical message service contract on L1.",
          "_l1TokenBridge": "Canonical token bridge contract on L1.",
          "_l1Usdc": "USDC address on L1.",
          "_l1UsdcBridge": "L1 USDC Bridge to ConsenSys's L2 Linea.",
          "_l1Weth": "WETH address on L1."
        }
      },
      "relayMessage(address,bytes)": {
        "params": {
          "message": "Data to send to target.",
          "target": "Contract on Linea that will receive message."
        }
      },
      "relayTokens(address,address,uint256,address)": {
        "params": {
          "amount": "Amount of L1 tokens to deposit and L2 tokens to receive.",
          "l1Token": "L1 token to deposit.",
          "l2Token": "L2 token to receive.",
          "to": "Bridge recipient."
        }
      }
    },
    "version": 1
  },
  "userdoc": {
    "kind": "user",
    "methods": {
      "constructor": {
        "notice": "Constructs new Adapter."
      },
      "relayMessage(address,bytes)": {
        "notice": "Send cross-chain message to target on Linea."
      },
      "relayTokens(address,address,uint256,address)": {
        "notice": "Bridge tokens to Linea."
      }
    },
    "version": 1
  },
  "storageLayout": {
    "storage": [],
    "types": null
  }
}
